{
  "schema_version": 1,
  "protocol_version": "1",
  "task_id": "operation-guide-example",
  "scenario_id": "create-record",
  "project_root": ".",
  "adapter": { "argv": ["node", "adapter.cjs", "manual"] },
  "phases": ["journey"],
  "validators": [
    { "id": "flow", "claim_id": "flow", "argv": ["node", "validator.cjs"], "input_context": "run-context@1" },
    { "id": "materials", "claim_id": "materials", "argv": ["node", "validator.cjs"], "input_context": "run-context@1" }
  ],
  "required_evidence": [
    { "id": "flow", "claim_id": "flow" },
    { "id": "video", "claim_id": "materials" },
    { "id": "manual", "claim_id": "materials" }
  ]
}
